ticker,company_name,edinet_code,jpx_industry,broad_sector,business_theme,listing_date,listing_note,business_summary,source_note
3543,コメダホールディングス,E32815,卸売業,食関連,カフェ・喫茶,2016-06-29,,喫茶店チェーン「コメダ珈琲店」を中心にFC展開を行う持株会社。,サンプル企業マスター
3087,ドトール・日レスホールディングス,E03518,小売業,店舗ビジネス,カフェ・喫茶,2007-10-01,,カフェチェーンと外食レストランを展開する持株会社。,サンプル企業マスター
3395,サンマルクホールディングス,E05556,小売業,店舗ビジネス,カフェ・外食,2006-03-01,,ベーカリーレストラン、カフェ、外食業態を展開する持株会社。,サンプル企業マスター
3038,神戸物産,E02999,卸売業,食関連,食品小売・卸売,2000-12-19,,業務スーパーを中心に食品小売・卸売、外食関連事業を展開する。,サンプル企業マスター
9201,日本航空,E04272,空運業,運輸,航空,2012-09-19,2012年に再上場。課題条件では再上場日を基準に判定する。,国内外の航空輸送サービスを提供する航空会社。,サンプル企業マスター
9202,ANAホールディングス,E04273,空運業,運輸,航空,1961-10-01,大学課題条件の2000-04-01以降上場には該当しない。,航空輸送を中核に航空関連サービスを展開する持株会社。,サンプル企業マスター
9206,スターフライヤー,E26084,空運業,運輸,航空,2011-12-21,,北九州を拠点に国内航空路線を運航する航空会社。,サンプル企業マスター
9204,スカイマーク,E04279,空運業,運輸,航空,2022-12-14,2022年に再上場。上場後3年以上の判定は実行日時点で確認する。,国内航空路線を運航する航空会社。,サンプル企業マスター

